kind,id,etag,selfLink,volumeInfo.title,volumeInfo.authors,volumeInfo.publisher,volumeInfo.publishedDate,volumeInfo.description,volumeInfo.industryIdentifiers,volumeInfo.readingModes.text,volumeInfo.readingModes.image,volumeInfo.pageCount,volumeInfo.printType,volumeInfo.categories,volumeInfo.averageRating,volumeInfo.ratingsCount,volumeInfo.maturityRating,volumeInfo.allowAnonLogging,volumeInfo.contentVersion,volumeInfo.panelizationSummary.containsEpubBubbles,volumeInfo.panelizationSummary.containsImageBubbles,volumeInfo.imageLinks.smallThumbnail,volumeInfo.imageLinks.thumbnail,volumeInfo.language,volumeInfo.previewLink,volumeInfo.infoLink,volumeInfo.canonicalVolumeLink,saleInfo.country,saleInfo.saleability,saleInfo.isEbook,saleInfo.listPrice.amount,saleInfo.listPrice.currencyCode,saleInfo.retailPrice.amount,saleInfo.retailPrice.currencyCode,saleInfo.buyLink,saleInfo.offers,accessInfo.country,accessInfo.viewability,accessInfo.embeddable,accessInfo.publicDomain,accessInfo.textToSpeechPermission,accessInfo.epub.isAvailable,accessInfo.epub.acsTokenLink,accessInfo.pdf.isAvailable,accessInfo.pdf.acsTokenLink,accessInfo.webReaderLink,accessInfo.accessViewStatus,accessInfo.quoteSharingAllowed,searchInfo.textSnippet,volumeInfo.subtitle
books#volume,omivDQAAQBAJ,GuL81AKXqqM,https://www.googleapis.com/books/v1/volumes/omivDQAAQBAJ,Deep Learning,"['Ian Goodfellow', 'Yoshua Bengio', 'Aaron Courville']",MIT Press,2016-11-10,"An introduction to a broad range of topics in deep learning, covering mathematical and conceptual background, deep learning techniques used in industry, and research perspectives. “Written by three experts in the field, Deep Learning is the only comprehensive book on the subject.” —Elon Musk, cochair of OpenAI; cofounder and CEO of Tesla and SpaceX Deep learning is a form of machine learning that enables computers to learn from experience and understand the world in terms of a hierarchy of concepts. Because the computer gathers knowledge from experience, there is no need for a human computer operator to formally specify all the knowledge that the computer needs. The hierarchy of concepts allows the computer to learn complicated concepts by building them out of simpler ones; a graph of these hierarchies would be many layers deep. This book introduces a broad range of topics in deep learning. The text offers mathematical and conceptual background, covering relevant concepts in linear algebra, probability theory and information theory, numerical computation, and machine learning. It describes deep learning techniques used by practitioners in industry, including deep feedforward networks, regularization, optimization algorithms, convolutional networks, sequence modeling, and practical methodology; and it surveys such applications as natural language processing, speech recognition, computer vision, online recommendation systems, bioinformatics, and videogames. Finally, the book offers research perspectives, covering such theoretical topics as linear factor models, autoencoders, representation learning, structured probabilistic models, Monte Carlo methods, the partition function, approximate inference, and deep generative models. Deep Learning can be used by undergraduate or graduate students planning careers in either industry or research, and by software engineers who want to begin using deep learning in their products or platforms. A website offers supplementary material for both readers and instructors.","[{'type': 'ISBN_13', 'identifier': '9780262337373'}, {'type': 'ISBN_10', 'identifier': '0262337371'}]",True,True,800.0,BOOK,['Computers'],5.0,1.0,NOT_MATURE,True,1.7.2.0.preview.3,False,False,http://books.google.com/books/content?id=omivDQAAQBAJ&printsec=frontcover&img=1&zoom=5&edge=curl&source=gbs_api,http://books.google.com/books/content?id=omivDQAAQBAJ&printsec=frontcover&img=1&zoom=1&edge=curl&source=gbs_api,en,http://books.google.com/books?id=omivDQAAQBAJ&pg=PP1&dq=Deep+Learning&hl=&cd=1&source=gbs_api,https://play.google.com/store/books/details?id=omivDQAAQBAJ&source=gbs_api,https://play.google.com/store/books/details?id=omivDQAAQBAJ,US,FOR_SALE,True,49.99,USD,49.99,USD,https://play.google.com/store/books/details?id=omivDQAAQBAJ&rdid=book-omivDQAAQBAJ&rdot=1&source=gbs_api,"[{'finskyOfferType': 1, 'listPrice': {'amountInMicros': 49990000, 'currencyCode': 'USD'}, 'retailPrice': {'amountInMicros': 49990000, 'currencyCode': 'USD'}, 'giftable': True}]",US,PARTIAL,True,False,ALLOWED,True,http://books.google.com/books/download/Deep_Learning-sample-epub.acsm?id=omivDQAAQBAJ&format=epub&output=acs4_fulfillment_token&dl_type=sample&source=gbs_api,True,http://books.google.com/books/download/Deep_Learning-sample-pdf.acsm?id=omivDQAAQBAJ&format=pdf&output=acs4_fulfillment_token&dl_type=sample&source=gbs_api,http://play.google.com/books/reader?id=omivDQAAQBAJ&hl=&printsec=frontcover&source=gbs_api,SAMPLE,False,The hierarchy of concepts allows the computer to learn complicated concepts by building them out of simpler ones; a graph of these hierarchies would be many layers deep. This book introduces a broad range of topics in deep learning.,
books#volume,Np9SDQAAQBAJ,soc6xRjGbXM,https://www.googleapis.com/books/v1/volumes/Np9SDQAAQBAJ,Deep Learning,"['Ian Goodfellow', 'Yoshua Bengio', 'Aaron Courville']",MIT Press,2016-11-18,"An introduction to a broad range of topics in deep learning, covering mathematical and conceptual background, deep learning techniques used in industry, and research perspectives. “Written by three experts in the field, Deep Learning is the only comprehensive book on the subject.” —Elon Musk, cochair of OpenAI; cofounder and CEO of Tesla and SpaceX Deep learning is a form of machine learning that enables computers to learn from experience and understand the world in terms of a hierarchy of concepts. Because the computer gathers knowledge from experience, there is no need for a human computer operator to formally specify all the knowledge that the computer needs. The hierarchy of concepts allows the computer to learn complicated concepts by building them out of simpler ones; a graph of these hierarchies would be many layers deep. This book introduces a broad range of topics in deep learning. The text offers mathematical and conceptual background, covering relevant concepts in linear algebra, probability theory and information theory, numerical computation, and machine learning. It describes deep learning techniques used by practitioners in industry, including deep feedforward networks, regularization, optimization algorithms, convolutional networks, sequence modeling, and practical methodology; and it surveys such applications as natural language processing, speech recognition, computer vision, online recommendation systems, bioinformatics, and videogames. Finally, the book offers research perspectives, covering such theoretical topics as linear factor models, autoencoders, representation learning, structured probabilistic models, Monte Carlo methods, the partition function, approximate inference, and deep generative models. Deep Learning can be used by undergraduate or graduate students planning careers in either industry or research, and by software engineers who want to begin using deep learning in their products or platforms. A website offers supplementary material for both readers and instructors.","[{'type': 'ISBN_13', 'identifier': '9780262035613'}, {'type': 'ISBN_10', 'identifier': '0262035618'}]",False,True,800.0,BOOK,['Computers'],3.5,5.0,NOT_MATURE,False,1.6.1.0.preview.1,False,False,http://books.google.com/books/content?id=Np9SDQAAQBAJ&printsec=frontcover&img=1&zoom=5&edge=curl&source=gbs_api,http://books.google.com/books/content?id=Np9SDQAAQBAJ&printsec=frontcover&img=1&zoom=1&edge=curl&source=gbs_api,en,http://books.google.com/books?id=Np9SDQAAQBAJ&pg=PP1&dq=Deep+Learning&hl=&cd=2&source=gbs_api,http://books.google.com/books?id=Np9SDQAAQBAJ&dq=Deep+Learning&hl=&source=gbs_api,https://books.google.com/books/about/Deep_Learning.html?hl=&id=Np9SDQAAQBAJ,US,NOT_FOR_SALE,False,,,,,,,US,PARTIAL,True,False,ALLOWED,False,,False,,http://play.google.com/books/reader?id=Np9SDQAAQBAJ&hl=&printsec=frontcover&source=gbs_api,SAMPLE,False,The hierarchy of concepts allows the computer to learn complicated concepts by building them out of simpler ones; a graph of these hierarchies would be many layers deep. This book introduces a broad range of topics in deep learning.,
books#volume,1g0KywEACAAJ,c8LEnRfT6UY,https://www.googleapis.com/books/v1/volumes/1g0KywEACAAJ,Deep Learning,['Ian Goodfellow'],,2013,,"[{'type': 'OTHER', 'identifier': 'OCLC:1120369889'}]",False,False,,BOOK,,,,NOT_MATURE,False,preview-1.0.0,False,False,,,en,http://books.google.com/books?id=1g0KywEACAAJ&dq=Deep+Learning&hl=&cd=3&source=gbs_api,http://books.google.com/books?id=1g0KywEACAAJ&dq=Deep+Learning&hl=&source=gbs_api,https://books.google.com/books/about/Deep_Learning.html?hl=&id=1g0KywEACAAJ,US,NOT_FOR_SALE,False,,,,,,,US,NO_PAGES,False,False,ALLOWED,False,,False,,http://play.google.com/books/reader?id=1g0KywEACAAJ&hl=&printsec=frontcover&source=gbs_api,NONE,False,,
books#volume,b06qDwAAQBAJ,O9Asqke2EtI,https://www.googleapis.com/books/v1/volumes/b06qDwAAQBAJ,Deep Learning,['John D. Kelleher'],MIT Press,2019-09-10,"An accessible introduction to the artificial intelligence technology that enables computer vision, speech recognition, machine translation, and driverless cars. Deep learning is an artificial intelligence technology that enables computer vision, speech recognition in mobile phones, machine translation, AI games, driverless cars, and other applications. When we use consumer products from Google, Microsoft, Facebook, Apple, or Baidu, we are often interacting with a deep learning system. In this volume in the MIT Press Essential Knowledge series, computer scientist John Kelleher offers an accessible and concise but comprehensive introduction to the fundamental technology at the heart of the artificial intelligence revolution. Kelleher explains that deep learning enables data-driven decisions by identifying and extracting patterns from large datasets; its ability to learn from complex data makes deep learning ideally suited to take advantage of the rapid growth in big data and computational power. Kelleher also explains some of the basic concepts in deep learning, presents a history of advances in the field, and discusses the current state of the art. He describes the most important deep learning architectures, including autoencoders, recurrent neural networks, and long short-term networks, as well as such recent developments as Generative Adversarial Networks and capsule networks. He also provides a comprehensive (and comprehensible) introduction to the two fundamental algorithms in deep learning: gradient descent and backpropagation. Finally, Kelleher considers the future of deep learning—major trends, possible developments, and significant challenges.","[{'type': 'ISBN_13', 'identifier': '9780262537551'}, {'type': 'ISBN_10', 'identifier': '0262537559'}]",False,True,296.0,BOOK,['Computers'],,,NOT_MATURE,False,1.3.0.0.preview.1,False,False,http://books.google.com/books/content?id=b06qDwAAQBAJ&printsec=frontcover&img=1&zoom=5&edge=curl&source=gbs_api,http://books.google.com/books/content?id=b06qDwAAQBAJ&printsec=frontcover&img=1&zoom=1&edge=curl&source=gbs_api,en,http://books.google.com/books?id=b06qDwAAQBAJ&printsec=frontcover&dq=Deep+Learning&hl=&cd=4&source=gbs_api,http://books.google.com/books?id=b06qDwAAQBAJ&dq=Deep+Learning&hl=&source=gbs_api,https://books.google.com/books/about/Deep_Learning.html?hl=&id=b06qDwAAQBAJ,US,NOT_FOR_SALE,False,,,,,,,US,PARTIAL,True,False,ALLOWED,False,,False,,http://play.google.com/books/reader?id=b06qDwAAQBAJ&hl=&printsec=frontcover&source=gbs_api,SAMPLE,False,"In this volume in the MIT Press Essential Knowledge series, computer scientist John Kelleher offers an accessible and concise but comprehensive introduction to the fundamental technology at the heart of the artificial intelligence ...",
books#volume,JjqRDwAAQBAJ,uS+9wGrOCuI,https://www.googleapis.com/books/v1/volumes/JjqRDwAAQBAJ,Deep Learning For Dummies,"['John Paul Mueller', 'Luca Massaron']",John Wiley & Sons,2019-05-14,"Take a deep dive into deep learning Deep learning provides the means for discerning patterns in the data that drive online business and social media outlets. Deep Learning for Dummies gives you the information you need to take the mystery out of the topic—and all of the underlying technologies associated with it. In no time, you’ll make sense of those increasingly confusing algorithms, and find a simple and safe environment to experiment with deep learning. The book develops a sense of precisely what deep learning can do at a high level and then provides examples of the major deep learning application types. Includes sample code Provides real-world examples within the approachable text Offers hands-on activities to make learning easier Shows you how to use Deep Learning more effectively with the right tools This book is perfect for those who want to better understand the basis of the underlying technologies that we use each and every day.","[{'type': 'ISBN_13', 'identifier': '9781119543046'}, {'type': 'ISBN_10', 'identifier': '1119543045'}]",False,True,368.0,BOOK,['Computers'],,,NOT_MATURE,False,0.4.1.0.preview.1,False,False,http://books.google.com/books/content?id=JjqRDwAAQBAJ&printsec=frontcover&img=1&zoom=5&edge=curl&source=gbs_api,http://books.google.com/books/content?id=JjqRDwAAQBAJ&printsec=frontcover&img=1&zoom=1&edge=curl&source=gbs_api,en,http://books.google.com/books?id=JjqRDwAAQBAJ&printsec=frontcover&dq=Deep+Learning&hl=&cd=5&source=gbs_api,http://books.google.com/books?id=JjqRDwAAQBAJ&dq=Deep+Learning&hl=&source=gbs_api,https://books.google.com/books/about/Deep_Learning_For_Dummies.html?hl=&id=JjqRDwAAQBAJ,US,NOT_FOR_SALE,False,,,,,,,US,PARTIAL,True,False,ALLOWED,False,,False,,http://play.google.com/books/reader?id=JjqRDwAAQBAJ&hl=&printsec=frontcover&source=gbs_api,SAMPLE,False,This book gives you the information you need to take the mystery out of the topic—and all of the underlying technologies associated with it.,
books#volume,LrT4DwAAQBAJ,ecbQKuKVHMU,https://www.googleapis.com/books/v1/volumes/LrT4DwAAQBAJ,Introduction to Deep Learning,['Eugene Charniak'],MIT Press,2019-01-29,"A project-based guide to the basics of deep learning. This concise, project-driven guide to deep learning takes readers through a series of program-writing tasks that introduce them to the use of deep learning in such areas of artificial intelligence as computer vision, natural-language processing, and reinforcement learning. The author, a longtime artificial intelligence researcher specializing in natural-language processing, covers feed-forward neural nets, convolutional neural nets, word embeddings, recurrent neural nets, sequence-to-sequence learning, deep reinforcement learning, unsupervised models, and other fundamental concepts and techniques. Students and practitioners learn the basics of deep learning by working through programs in Tensorflow, an open-source machine learning framework. “I find I learn computer science material best by sitting down and writing programs,” the author writes, and the book reflects this approach. Each chapter includes a programming project, exercises, and references for further reading. An early chapter is devoted to Tensorflow and its interface with Python, the widely used programming language. Familiarity with linear algebra, multivariate calculus, and probability and statistics is required, as is a rudimentary knowledge of programming in Python. The book can be used in both undergraduate and graduate courses; practitioners will find it an essential reference.","[{'type': 'ISBN_13', 'identifier': '9780262039512'}, {'type': 'ISBN_10', 'identifier': '0262039516'}]",False,True,192.0,BOOK,['Computers'],4.0,1.0,NOT_MATURE,False,preview-1.0.0,False,False,http://books.google.com/books/content?id=LrT4DwAAQBAJ&printsec=frontcover&img=1&zoom=5&edge=curl&source=gbs_api,http://books.google.com/books/content?id=LrT4DwAAQBAJ&printsec=frontcover&img=1&zoom=1&edge=curl&source=gbs_api,en,http://books.google.com/books?id=LrT4DwAAQBAJ&printsec=frontcover&dq=Deep+Learning&hl=&cd=6&source=gbs_api,http://books.google.com/books?id=LrT4DwAAQBAJ&dq=Deep+Learning&hl=&source=gbs_api,https://books.google.com/books/about/Introduction_to_Deep_Learning.html?hl=&id=LrT4DwAAQBAJ,US,NOT_FOR_SALE,False,,,,,,,US,PARTIAL,True,False,ALLOWED,False,,False,,http://play.google.com/books/reader?id=LrT4DwAAQBAJ&hl=&printsec=frontcover&source=gbs_api,SAMPLE,False,The book can be used in both undergraduate and graduate courses; practitioners will find it an essential reference.,
books#volume,5cNKDwAAQBAJ,s/DTEqoEzAY,https://www.googleapis.com/books/v1/volumes/5cNKDwAAQBAJ,Introduction to Deep Learning,['Sandro Skansi'],Springer,2018-02-04,"This textbook presents a concise, accessible and engaging first introduction to deep learning, offering a wide range of connectionist models which represent the current state-of-the-art. The text explores the most popular algorithms and architectures in a simple and intuitive style, explaining the mathematical derivations in a step-by-step manner. The content coverage includes convolutional networks, LSTMs, Word2vec, RBMs, DBNs, neural Turing machines, memory networks and autoencoders. Numerous examples in working Python code are provided throughout the book, and the code is also supplied separately at an accompanying website. Topics and features: introduces the fundamentals of machine learning, and the mathematical and computational prerequisites for deep learning; discusses feed-forward neural networks, and explores the modifications to these which can be applied to any neural network; examines convolutional neural networks, and the recurrent connections to a feed-forward neural network; describes the notion of distributed representations, the concept of the autoencoder, and the ideas behind language processing with deep learning; presents a brief history of artificial intelligence and neural networks, and reviews interesting open research problems in deep learning and connectionism. This clearly written and lively primer on deep learning is essential reading for graduate and advanced undergraduate students of computer science, cognitive science and mathematics, as well as fields such as linguistics, logic, philosophy, and psychology.","[{'type': 'ISBN_13', 'identifier': '9783319730042'}, {'type': 'ISBN_10', 'identifier': '3319730045'}]",True,True,191.0,BOOK,['Computers'],,,NOT_MATURE,True,1.2.2.0.preview.3,False,False,http://books.google.com/books/content?id=5cNKDwAAQBAJ&printsec=frontcover&img=1&zoom=5&edge=curl&source=gbs_api,http://books.google.com/books/content?id=5cNKDwAAQBAJ&printsec=frontcover&img=1&zoom=1&edge=curl&source=gbs_api,en,http://books.google.com/books?id=5cNKDwAAQBAJ&pg=PP1&dq=Deep+Learning&hl=&cd=7&source=gbs_api,https://play.google.com/store/books/details?id=5cNKDwAAQBAJ&source=gbs_api,https://play.google.com/store/books/details?id=5cNKDwAAQBAJ,US,FOR_SALE_AND_RENTAL,True,59.99,USD,47.39,USD,https://play.google.com/store/books/details?id=5cNKDwAAQBAJ&rdid=book-5cNKDwAAQBAJ&rdot=1&source=gbs_api,"[{'finskyOfferType': 1, 'listPrice': {'amountInMicros': 59990000, 'currencyCode': 'USD'}, 'retailPrice': {'amountInMicros': 47390000, 'currencyCode': 'USD'}, 'giftable': True}, {'finskyOfferType': 3, 'listPrice': {'amountInMicros': 21000000, 'currencyCode': 'USD'}, 'retailPrice': {'amountInMicros': 18270000, 'currencyCode': 'USD'}, 'rentalDuration': {'unit': 'DAY', 'count': 90}}]",US,PARTIAL,True,False,ALLOWED,True,http://books.google.com/books/download/Introduction_to_Deep_Learning-sample-epub.acsm?id=5cNKDwAAQBAJ&format=epub&output=acs4_fulfillment_token&dl_type=sample&source=gbs_api,True,http://books.google.com/books/download/Introduction_to_Deep_Learning-sample-pdf.acsm?id=5cNKDwAAQBAJ&format=pdf&output=acs4_fulfillment_token&dl_type=sample&source=gbs_api,http://play.google.com/books/reader?id=5cNKDwAAQBAJ&hl=&printsec=frontcover&source=gbs_api,SAMPLE,False,"The text explores the most popular algorithms and architectures in a simple and intuitive style, explaining the mathematical derivations in a step-by-step manner.",From Logical Calculus to Artificial Intelligence
books#volume,J1enDwAAQBAJ,ZAZziKLryBk,https://www.googleapis.com/books/v1/volumes/J1enDwAAQBAJ,Deep Learning Illustrated,"['Jon Krohn', 'Grant Beyleveld', 'Aglaé Bassens']",Addison-Wesley Professional,2019-08-05,"""The authors’ clear visual style provides a comprehensive look at what’s currently possible with artificial neural networks as well as a glimpse of the magic that’s to come."" –Tim Urban, author of Wait But Why Fully Practical, Insightful Guide to Modern Deep Learning Deep learning is transforming software, facilitating powerful new artificial intelligence capabilities, and driving unprecedented algorithm performance. Deep Learning Illustrated is uniquely intuitive and offers a complete introduction to the discipline’s techniques. Packed with full-color figures and easy-to-follow code, it sweeps away the complexity of building deep learning models, making the subject approachable and fun to learn. World-class instructor and practitioner Jon Krohn–with visionary content from Grant Beyleveld and beautiful illustrations by Aglaé Bassens–presents straightforward analogies to explain what deep learning is, why it has become so popular, and how it relates to other machine learning approaches. Krohn has created a practical reference and tutorial for developers, data scientists, researchers, analysts, and students who want to start applying it. He illuminates theory with hands-on Python code in accompanying Jupyter notebooks. To help you progress quickly, he focuses on the versatile deep learning library Keras to nimbly construct efficient TensorFlow models; PyTorch, the leading alternative library, is also covered. You’ll gain a pragmatic understanding of all major deep learning approaches and their uses in applications ranging from machine vision and natural language processing to image generation and game-playing algorithms. Discover what makes deep learning systems unique, and the implications for practitioners Explore new tools that make deep learning models easier to build, use, and improve Master essential theory: artificial neurons, training, optimization, convolutional nets, recurrent nets, generative adversarial networks (GANs), deep reinforcement learning, and more Walk through building interactive deep learning applications, and move forward with your own artificial intelligence projects Register your book for convenient access to downloads, updates, and/or corrections as they become available. See inside book for details.","[{'type': 'ISBN_13', 'identifier': '9780135121726'}, {'type': 'ISBN_10', 'identifier': '0135121728'}]",True,True,416.0,BOOK,['Computers'],5.0,1.0,NOT_MATURE,True,1.3.4.0.preview.3,False,False,http://books.google.com/books/content?id=J1enDwAAQBAJ&printsec=frontcover&img=1&zoom=5&edge=curl&source=gbs_api,http://books.google.com/books/content?id=J1enDwAAQBAJ&printsec=frontcover&img=1&zoom=1&edge=curl&source=gbs_api,en,http://books.google.com/books?id=J1enDwAAQBAJ&pg=PA1&dq=Deep+Learning&hl=&cd=8&source=gbs_api,https://play.google.com/store/books/details?id=J1enDwAAQBAJ&source=gbs_api,https://play.google.com/store/books/details?id=J1enDwAAQBAJ,US,FOR_SALE,True,39.99,USD,31.19,USD,https://play.google.com/store/books/details?id=J1enDwAAQBAJ&rdid=book-J1enDwAAQBAJ&rdot=1&source=gbs_api,"[{'finskyOfferType': 1, 'listPrice': {'amountInMicros': 39990000, 'currencyCode': 'USD'}, 'retailPrice': {'amountInMicros': 31190000, 'currencyCode': 'USD'}, 'giftable': True}]",US,PARTIAL,True,False,ALLOWED_FOR_ACCESSIBILITY,True,http://books.google.com/books/download/Deep_Learning_Illustrated-sample-epub.acsm?id=J1enDwAAQBAJ&format=epub&output=acs4_fulfillment_token&dl_type=sample&source=gbs_api,True,http://books.google.com/books/download/Deep_Learning_Illustrated-sample-pdf.acsm?id=J1enDwAAQBAJ&format=pdf&output=acs4_fulfillment_token&dl_type=sample&source=gbs_api,http://play.google.com/books/reader?id=J1enDwAAQBAJ&hl=&printsec=frontcover&source=gbs_api,SAMPLE,False,Deep Learning Illustrated is uniquely intuitive and offers a complete introduction to the discipline’s techniques.,"A Visual, Interactive Guide to Artificial Intelligence"
