books#volume,xDszEAAAQBAJ,KX6iSYUNgc8,https://www.googleapis.com/books/v1/volumes/xDszEAAAQBAJ,Build a Career in Data Science,"['Emily Robinson', 'Jacqueline Nolis']",Simon and Schuster,2020-03-06,"Summary You are going to need more than technical knowledge to succeed as a data scientist. Build a Career in Data Science teaches you what school leaves out, from how to land your first job to the lifecycle of a data science project, and even how to become a manager. Purchase of the print book includes a free eBook in PDF, Kindle, and ePub formats from Manning Publications. About the technology What are the keys to a data scientist’s long-term success? Blending your technical know-how with the right “soft skills” turns out to be a central ingredient of a rewarding career. About the book Build a Career in Data Science is your guide to landing your first data science job and developing into a valued senior employee. By following clear and simple instructions, you’ll learn to craft an amazing resume and ace your interviews. In this demanding, rapidly changing field, it can be challenging to keep projects on track, adapt to company needs, and manage tricky stakeholders. You’ll love the insights on how to handle expectations, deal with failures, and plan your career path in the stories from seasoned data scientists included in the book. What's inside Creating a portfolio of data science projects Assessing and negotiating an offer Leaving gracefully and moving up the ladder Interviews with professional data scientists About the reader For readers who want to begin or advance a data science career. About the author Emily Robinson is a data scientist at Warby Parker. Jacqueline Nolis is a data science consultant and mentor. Table of Contents: PART 1 - GETTING STARTED WITH DATA SCIENCE 1. What is data science? 2. Data science companies 3. Getting the skills 4. Building a portfolio PART 2 - FINDING YOUR DATA SCIENCE JOB 5. The search: Identifying the right job for you 6. The application: Résumés and cover letters 7. The interview: What to expect and how to handle it 8. The offer: Knowing what to accept PART 3 - SETTLING INTO DATA SCIENCE 9. The first months on the job 10. Making an effective analysis 11. Deploying a model into production 12. Working with stakeholders PART 4 - GROWING IN YOUR DATA SCIENCE ROLE 13. When your data science project fails 14. Joining the data science community 15. Leaving your job gracefully 16. Moving up the ladder","[{'type': 'ISBN_13', 'identifier': '9781638350156'}, {'type': 'ISBN_10', 'identifier': '1638350159'}]",True,False,354.0,BOOK,['Computers'],,,NOT_MATURE,False,preview-1.0.0,http://books.google.com/books/content?id=xDszEAAAQBAJ&printsec=frontcover&img=1&zoom=5&edge=curl&source=gbs_api,http://books.google.com/books/content?id=xDszEAAAQBAJ&printsec=frontcover&img=1&zoom=1&edge=curl&source=gbs_api,en,http://books.google.com/books?id=xDszEAAAQBAJ&pg=PP1&dq=Data+Science&hl=&cd=8&source=gbs_api,https://play.google.com/store/books/details?id=xDszEAAAQBAJ&source=gbs_api,https://play.google.com/store/books/details?id=xDszEAAAQBAJ,US,FOR_SALE,True,US,PARTIAL,True,False,ALLOWED_FOR_ACCESSIBILITY,True,False,http://play.google.com/books/reader?id=xDszEAAAQBAJ&hl=&printsec=frontcover&source=gbs_api,SAMPLE,False,About the book Build a Career in Data Science is your guide to landing your first data science job and developing into a valued senior employee.,False,False,,28.99,USD,28.99,USD,https://play.google.com/store/books/details?id=xDszEAAAQBAJ&rdid=book-xDszEAAAQBAJ&rdot=1&source=gbs_api,"[{'finskyOfferType': 1, 'listPrice': {'amountInMicros': 28990000, 'currencyCode': 'USD'}, 'retailPrice': {'amountInMicros': 28990000, 'currencyCode': 'USD'}, 'giftable': True}]",http://books.google.com/books/download/Build_a_Career_in_Data_Science-sample-epub.acsm?id=xDszEAAAQBAJ&format=epub&output=acs4_fulfillment_token&dl_type=sample&source=gbs_api,,Data Science
books#volume,b4YxCwAAQBAJ,1SUQ7oMcE8Q,https://www.googleapis.com/books/v1/volumes/b4YxCwAAQBAJ,Getting Started with Data Science,['Murtaza Haider'],IBM Press,2015-12-14,"Master Data Analytics Hands-On by Solving Fascinating Problems You’ll Actually Enjoy! Harvard Business Review recently called data science “The Sexiest Job of the 21st Century.” It’s not just sexy: For millions of managers, analysts, and students who need to solve real business problems, it’s indispensable. Unfortunately, there’s been nothing easy about learning data science–until now. Getting Started with Data Science takes its inspiration from worldwide best-sellers like Freakonomics and Malcolm Gladwell’s Outliers: It teaches through a powerful narrative packed with unforgettable stories. Murtaza Haider offers informative, jargon-free coverage of basic theory and technique, backed with plenty of vivid examples and hands-on practice opportunities. Everything’s software and platform agnostic, so you can learn data science whether you work with R, Stata, SPSS, or SAS. Best of all, Haider teaches a crucial skillset most data science books ignore: how to tell powerful stories using graphics and tables. Every chapter is built around real research challenges, so you’ll always know why you’re doing what you’re doing. You’ll master data science by answering fascinating questions, such as: • Are religious individuals more or less likely to have extramarital affairs? • Do attractive professors get better teaching evaluations? • Does the higher price of cigarettes deter smoking? • What determines housing prices more: lot size or the number of bedrooms? • How do teenagers and older people differ in the way they use social media? • Who is more likely to use online dating services? • Why do some purchase iPhones and others Blackberry devices? • Does the presence of children influence a family’s spending on alcohol? For each problem, you’ll walk through defining your question and the answers you’ll need; exploring how others have approached similar challenges; selecting your data and methods; generating your statistics; organizing your report; and telling your story. Throughout, the focus is squarely on what matters most: transforming data into insights that are clear, accurate, and can be acted upon.","[{'type': 'ISBN_13', 'identifier': '9780133991239'}, {'type': 'ISBN_10', 'identifier': '0133991237'}]",True,True,400.0,BOOK,['Business & Economics'],,,NOT_MATURE,True,1.1.1.0.preview.3,http://books.google.com/books/content?id=b4YxCwAAQBAJ&printsec=frontcover&img=1&zoom=5&edge=curl&source=gbs_api,http://books.google.com/books/content?id=b4YxCwAAQBAJ&printsec=frontcover&img=1&zoom=1&edge=curl&source=gbs_api,en,http://books.google.com/books?id=b4YxCwAAQBAJ&pg=PA1&dq=Data+Science&hl=&cd=9&source=gbs_api,https://play.google.com/store/books/details?id=b4YxCwAAQBAJ&source=gbs_api,https://play.google.com/store/books/details?id=b4YxCwAAQBAJ,US,FOR_SALE,True,US,PARTIAL,True,False,ALLOWED_FOR_ACCESSIBILITY,True,True,http://play.google.com/books/reader?id=b4YxCwAAQBAJ&hl=&printsec=frontcover&source=gbs_api,SAMPLE,False,Getting Started with Data Science takes its inspiration from worldwide best-sellers like Freakonomics and Malcolm Gladwell’s Outliers: It teaches through a powerful narrative packed with unforgettable stories.,False,False,Making Sense of Data with Analytics,31.99,USD,18.49,USD,https://play.google.com/store/books/details?id=b4YxCwAAQBAJ&rdid=book-b4YxCwAAQBAJ&rdot=1&source=gbs_api,"[{'finskyOfferType': 1, 'listPrice': {'amountInMicros': 31990000, 'currencyCode': 'USD'}, 'retailPrice': {'amountInMicros': 18490000, 'currencyCode': 'USD'}, 'giftable': True}]",http://books.google.com/books/download/Getting_Started_with_Data_Science-sample-epub.acsm?id=b4YxCwAAQBAJ&format=epub&output=acs4_fulfillment_token&dl_type=sample&source=gbs_api,http://books.google.com/books/download/Getting_Started_with_Data_Science-sample-pdf.acsm?id=b4YxCwAAQBAJ&format=pdf&output=acs4_fulfillment_token&dl_type=sample&source=gbs_api,Data Science
books#volume,BnB6DwAAQBAJ,XYt3GO5frRs,https://www.googleapis.com/books/v1/volumes/BnB6DwAAQBAJ,Programming Skills for Data Science,"['Michael Freeman', 'Joel Ross']",Addison-Wesley Professional,2018-11-23,"The Foundational Hands-On Skills You Need to Dive into Data Science “Freeman and Ross have created the definitive resource for new and aspiring data scientists to learn foundational programming skills.” –From the foreword by Jared Lander, series editor Using data science techniques, you can transform raw data into actionable insights for domains ranging from urban planning to precision medicine. Programming Skills for Data Science brings together all the foundational skills you need to get started, even if you have no programming or data science experience. Leading instructors Michael Freeman and Joel Ross guide you through installing and configuring the tools you need to solve professional-level data science problems, including the widely used R language and Git version-control system. They explain how to wrangle your data into a form where it can be easily used, analyzed, and visualized so others can see the patterns you’ve uncovered. Step by step, you’ll master powerful R programming techniques and troubleshooting skills for probing data in new ways, and at larger scales. Freeman and Ross teach through practical examples and exercises that can be combined into complete data science projects. Everything’s focused on real-world application, so you can quickly start analyzing your own data and getting answers you can act upon. Learn to Install your complete data science environment, including R and RStudio Manage projects efficiently, from version tracking to documentation Host, manage, and collaborate on data science projects with GitHub Master R language fundamentals: syntax, programming concepts, and data structures Load, format, explore, and restructure data for successful analysis Interact with databases and web APIs Master key principles for visualizing data accurately and intuitively Produce engaging, interactive visualizations with ggplot and other R packages Transform analyses into sharable documents and sites with R Markdown Create interactive web data science applications with Shiny Collaborate smoothly as part of a data science team Register your book for convenient access to downloads, updates, and/or corrections as they become available. See inside book for details.","[{'type': 'ISBN_13', 'identifier': '9780135159088'}, {'type': 'ISBN_10', 'identifier': '0135159083'}]",True,True,384.0,BOOK,['Computers'],,,NOT_MATURE,True,1.2.2.0.preview.3,http://books.google.com/books/content?id=BnB6DwAAQBAJ&printsec=frontcover&img=1&zoom=5&edge=curl&source=gbs_api,http://books.google.com/books/content?id=BnB6DwAAQBAJ&printsec=frontcover&img=1&zoom=1&edge=curl&source=gbs_api,en,http://books.google.com/books?id=BnB6DwAAQBAJ&printsec=frontcover&dq=Data+Science&hl=&cd=10&source=gbs_api,https://play.google.com/store/books/details?id=BnB6DwAAQBAJ&source=gbs_api,https://play.google.com/store/books/details?id=BnB6DwAAQBAJ,US,FOR_SALE,True,US,PARTIAL,True,False,ALLOWED_FOR_ACCESSIBILITY,True,True,http://play.google.com/books/reader?id=BnB6DwAAQBAJ&hl=&printsec=frontcover&source=gbs_api,SAMPLE,False,"Programming Skills for Data Science brings together all the foundational skills you need to get started, even if you have no programming or data science experience.",False,False,"Start Writing Code to Wrangle, Analyze, and Visualize Data with R",39.99,USD,31.19,USD,https://play.google.com/store/books/details?id=BnB6DwAAQBAJ&rdid=book-BnB6DwAAQBAJ&rdot=1&source=gbs_api,"[{'finskyOfferType': 1, 'listPrice': {'amountInMicros': 39990000, 'currencyCode': 'USD'}, 'retailPrice': {'amountInMicros': 31190000, 'currencyCode': 'USD'}, 'giftable': True}]",http://books.google.com/books/download/Programming_Skills_for_Data_Science-sample-epub.acsm?id=BnB6DwAAQBAJ&format=epub&output=acs4_fulfillment_token&dl_type=sample&source=gbs_api,http://books.google.com/books/download/Programming_Skills_for_Data_Science-sample-pdf.acsm?id=BnB6DwAAQBAJ&format=pdf&output=acs4_fulfillment_token&dl_type=sample&source=gbs_api,Data Science
books#volume,KqSKipJfxMwC,LJids6uz5xM,https://www.googleapis.com/books/v1/volumes/KqSKipJfxMwC,Head First Data Analysis,['Michael Milton'],"""O'Reilly Media, Inc.""",2009-07-24,"A guide for data managers and analyzers shares guidelines for identifying patterns, predicting future outcomes, and presenting findings to others; drawing on current research in cognitive science and learning theory while covering such additional topics as assessing data quality, handling ambiguous information, and organizing data within market groups. Original.","[{'type': 'ISBN_13', 'identifier': '9780596153939'}, {'type': 'ISBN_10', 'identifier': '0596153937'}]",False,True,445.0,BOOK,['Business & Economics'],3.5,5.0,NOT_MATURE,False,2.3.0.0.preview.1,http://books.google.com/books/content?id=KqSKipJfxMwC&printsec=frontcover&img=1&zoom=5&edge=curl&source=gbs_api,http://books.google.com/books/content?id=KqSKipJfxMwC&printsec=frontcover&img=1&zoom=1&edge=curl&source=gbs_api,en,http://books.google.com/books?id=KqSKipJfxMwC&printsec=frontcover&dq=Data+Analysis&hl=&cd=1&source=gbs_api,http://books.google.com/books?id=KqSKipJfxMwC&dq=Data+Analysis&hl=&source=gbs_api,https://books.google.com/books/about/Head_First_Data_Analysis.html?hl=&id=KqSKipJfxMwC,US,NOT_FOR_SALE,False,US,PARTIAL,True,False,ALLOWED,False,True,http://play.google.com/books/reader?id=KqSKipJfxMwC&hl=&printsec=frontcover&source=gbs_api,SAMPLE,False,"A guide for data managers and analyzers shares guidelines for identifying patterns, predicting future outcomes, and presenting findings to others; drawing on current research in cognitive science and learning theory while covering such ...",,,"A Learner's Guide to Big Numbers, Statistics, and Good Decisions",,,,,,,,,Data Analytics
books#volume,mTXnXCLXJYgC,nl2Md9t7fx0,https://www.googleapis.com/books/v1/volumes/mTXnXCLXJYgC,Data Analysis with Open Source Tools,['Philipp K. Janert'],"""O'Reilly Media, Inc.""",2010-11-11,"Collecting data is relatively easy, but turning raw information into something useful requires that you know how to extract precisely what you need. With this insightful book, intermediate to experienced programmers interested in data analysis will learn techniques for working with data in a business environment. You'll learn how to look at data to discover what it contains, how to capture those ideas in conceptual models, and then feed your understanding back into the organization through business plans, metrics dashboards, and other applications. Along the way, you'll experiment with concepts through hands-on workshops at the end of each chapter. Above all, you'll learn how to think about the results you want to achieve -- rather than rely on tools to think for you. Use graphics to describe data with one, two, or dozens of variables Develop conceptual models using back-of-the-envelope calculations, as well asscaling and probability arguments Mine data with computationally intensive methods such as simulation and clustering Make your conclusions understandable through reports, dashboards, and other metrics programs Understand financial calculations, including the time-value of money Use dimensionality reduction techniques or predictive analytics to conquer challenging data analysis situations Become familiar with different open source programming environments for data analysis ""Finally, a concise reference for understanding how to conquer piles of data.""--Austin King, Senior Web Developer, Mozilla ""An indispensable text for aspiring data scientists.""--Michael E. Driscoll, CEO/Founder, Dataspora","[{'type': 'ISBN_10', 'identifier': '1449396658'}, {'type': 'ISBN_13', 'identifier': '9781449396657'}]",True,True,540.0,BOOK,['Computers'],4.0,2.0,NOT_MATURE,True,1.8.9.0.preview.3,http://books.google.com/books/content?id=mTXnXCLXJYgC&printsec=frontcover&img=1&zoom=5&edge=curl&source=gbs_api,http://books.google.com/books/content?id=mTXnXCLXJYgC&printsec=frontcover&img=1&zoom=1&edge=curl&source=gbs_api,en,http://books.google.com/books?id=mTXnXCLXJYgC&printsec=frontcover&dq=Data+Analysis&hl=&cd=2&source=gbs_api,https://play.google.com/store/books/details?id=mTXnXCLXJYgC&source=gbs_api,https://play.google.com/store/books/details?id=mTXnXCLXJYgC,US,FOR_SALE,True,US,PARTIAL,True,False,ALLOWED,True,True,http://play.google.com/books/reader?id=mTXnXCLXJYgC&hl=&printsec=frontcover&source=gbs_api,SAMPLE,False,"With this insightful book, intermediate to experienced programmers interested in data analysis will learn techniques for working with data in a business environment.",False,False,A Hands-On Guide for Programmers and Data Scientists,31.99,USD,31.99,USD,https://play.google.com/store/books/details?id=mTXnXCLXJYgC&rdid=book-mTXnXCLXJYgC&rdot=1&source=gbs_api,"[{'finskyOfferType': 1, 'listPrice': {'amountInMicros': 31990000, 'currencyCode': 'USD'}, 'retailPrice': {'amountInMicros': 31990000, 'currencyCode': 'USD'}, 'giftable': True}]",,,Data Analytics
books#volume,UiM3DwAAQBAJ,wkmzfFI4/Qg,https://www.googleapis.com/books/v1/volumes/UiM3DwAAQBAJ,Python for Data Analysis,['Wes McKinney'],"""O'Reilly Media, Inc.""",2017-09-25,"Get complete instructions for manipulating, processing, cleaning, and crunching datasets in Python. Updated for Python 3.6, the second edition of this hands-on guide is packed with practical case studies that show you how to solve a broad set of data analysis problems effectively. You’ll learn the latest versions of pandas, NumPy, IPython, and Jupyter in the process. Written by Wes McKinney, the creator of the Python pandas project, this book is a practical, modern introduction to data science tools in Python. It’s ideal for analysts new to Python and for Python programmers new to data science and scientific computing. Data files and related material are available on GitHub. Use the IPython shell and Jupyter notebook for exploratory computing Learn basic and advanced features in NumPy (Numerical Python) Get started with data analysis tools in the pandas library Use flexible tools to load, clean, transform, merge, and reshape data Create informative visualizations with matplotlib Apply the pandas groupby facility to slice, dice, and summarize datasets Analyze and manipulate regular and irregular time series data Learn how to solve real-world data analysis problems with thorough, detailed examples","[{'type': 'ISBN_13', 'identifier': '9781491957615'}, {'type': 'ISBN_10', 'identifier': '1491957611'}]",True,True,676.0,BOOK,['Computers'],5.0,1.0,NOT_MATURE,True,1.5.7.0.preview.3,http://books.google.com/books/content?id=UiM3DwAAQBAJ&printsec=frontcover&img=1&zoom=5&edge=curl&source=gbs_api,http://books.google.com/books/content?id=UiM3DwAAQBAJ&printsec=frontcover&img=1&zoom=1&edge=curl&source=gbs_api,en,http://books.google.com/books?id=UiM3DwAAQBAJ&pg=PP1&dq=Data+Analysis&hl=&cd=3&source=gbs_api,http://books.google.com/books?id=UiM3DwAAQBAJ&dq=Data+Analysis&hl=&source=gbs_api,https://books.google.com/books/about/Python_for_Data_Analysis.html?hl=&id=UiM3DwAAQBAJ,US,NOT_FOR_SALE,False,US,PARTIAL,True,False,ALLOWED,True,True,http://play.google.com/books/reader?id=UiM3DwAAQBAJ&hl=&printsec=frontcover&source=gbs_api,SAMPLE,False,"You’ll learn the latest versions of pandas, NumPy, IPython, and Jupyter in the process. Written by Wes McKinney, the creator of the Python pandas project, this book is a practical, modern introduction to data science tools in Python.",False,False,"Data Wrangling with Pandas, NumPy, and IPython",,,,,,,,,Data Analytics
books#volume,woBcDgAAQBAJ,F3frEw8676M,https://www.googleapis.com/books/v1/volumes/woBcDgAAQBAJ,Practical Data Analysis,"['Hector Cuesta', 'Dr. Sampath Kumar']",Packt Publishing Ltd,2016-09-30,"A practical guide to obtaining, transforming, exploring, and analyzing data using Python, MongoDB, and Apache Spark About This Book Learn to use various data analysis tools and algorithms to classify, cluster, visualize, simulate, and forecast your data Apply Machine Learning algorithms to different kinds of data such as social networks, time series, and images A hands-on guide to understanding the nature of data and how to turn it into insight Who This Book Is For This book is for developers who want to implement data analysis and data-driven algorithms in a practical way. It is also suitable for those without a background in data analysis or data processing. Basic knowledge of Python programming, statistics, and linear algebra is assumed. What You Will Learn Acquire, format, and visualize your data Build an image-similarity search engine Generate meaningful visualizations anyone can understand Get started with analyzing social network graphs Find out how to implement sentiment text analysis Install data analysis tools such as Pandas, MongoDB, and Apache Spark Get to grips with Apache Spark Implement machine learning algorithms such as classification or forecasting In Detail Beyond buzzwords like Big Data or Data Science, there are a great opportunities to innovate in many businesses using data analysis to get data-driven products. Data analysis involves asking many questions about data in order to discover insights and generate value for a product or a service. This book explains the basic data algorithms without the theoretical jargon, and you'll get hands-on turning data into insights using machine learning techniques. We will perform data-driven innovation processing for several types of data such as text, Images, social network graphs, documents, and time series, showing you how to implement large data processing with MongoDB and Apache Spark. Style and approach This is a hands-on guide to data analysis and data processing. The concrete examples are explained with simple code and accessible data.","[{'type': 'ISBN_13', 'identifier': '9781785286667'}, {'type': 'ISBN_10', 'identifier': '1785286668'}]",True,True,338.0,BOOK,['Computers'],,,NOT_MATURE,False,1.2.2.0.preview.3,http://books.google.com/books/content?id=woBcDgAAQBAJ&printsec=frontcover&img=1&zoom=5&edge=curl&source=gbs_api,http://books.google.com/books/content?id=woBcDgAAQBAJ&printsec=frontcover&img=1&zoom=1&edge=curl&source=gbs_api,en,http://books.google.com/books?id=woBcDgAAQBAJ&pg=PP1&dq=Data+Analysis&hl=&cd=4&source=gbs_api,https://play.google.com/store/books/details?id=woBcDgAAQBAJ&source=gbs_api,https://play.google.com/store/books/details?id=woBcDgAAQBAJ,US,FOR_SALE,True,US,PARTIAL,True,False,ALLOWED,True,True,http://play.google.com/books/reader?id=woBcDgAAQBAJ&hl=&printsec=frontcover&source=gbs_api,SAMPLE,False,"A practical guide to obtaining, transforming, exploring, and analyzing data using Python, MongoDB, and Apache Spark About This Book Learn to use various data analysis tools and algorithms to classify, cluster, visualize, simulate, and ...",False,False,,41.99,USD,31.91,USD,https://play.google.com/store/books/details?id=woBcDgAAQBAJ&rdid=book-woBcDgAAQBAJ&rdot=1&source=gbs_api,"[{'finskyOfferType': 1, 'listPrice': {'amountInMicros': 41990000, 'currencyCode': 'USD'}, 'retailPrice': {'amountInMicros': 31910000, 'currencyCode': 'USD'}, 'giftable': True}]",,,Data Analytics
books#volume,UT9dAAAAIAAJ,vtM5aPdidzI,https://www.googleapis.com/books/v1/volumes/UT9dAAAAIAAJ,Exploratory Data Analysis,['John Wilder Tukey'],Addison-Wesley Publishing Company,1977,"This book serves as an introductory text for exploratory data analysis. It exposes readers and users to a variety of techniques for looking more effectively at data. The emphasis is on general techniques, rather than specific problems.","[{'type': 'OTHER', 'identifier': 'STANFORD:36105001914998'}]",False,False,716.0,BOOK,['Mathematics'],5.0,1.0,NOT_MATURE,False,1.4.2.0.preview.0,http://books.google.com/books/content?id=UT9dAAAAIAAJ&printsec=frontcover&img=1&zoom=5&source=gbs_api,http://books.google.com/books/content?id=UT9dAAAAIAAJ&printsec=frontcover&img=1&zoom=1&source=gbs_api,en,http://books.google.com/books?id=UT9dAAAAIAAJ&q=Data+Analysis&dq=Data+Analysis&hl=&cd=5&source=gbs_api,http://books.google.com/books?id=UT9dAAAAIAAJ&dq=Data+Analysis&hl=&source=gbs_api,https://books.google.com/books/about/Exploratory_Data_Analysis.html?hl=&id=UT9dAAAAIAAJ,US,NOT_FOR_SALE,False,US,NO_PAGES,False,False,ALLOWED,False,False,http://play.google.com/books/reader?id=UT9dAAAAIAAJ&hl=&printsec=frontcover&source=gbs_api,NONE,False,"This book serves as an introductory text for exploratory data analysis. It exposes readers and users to a variety of techniques for looking more effectively at data. The emphasis is on general techniques, rather than specific problems.",False,False,,,,,,,,,,Data Analytics
